{
  "schema_version": "1.0.0",
  "study_id": "HS-01",
  "config_version": "1.0.0",
  "config_sha256": "dcffdeca45b972f5c63a4f2c5d1e66e12823f2686ad7d190229260402d22e49b",
  "session_id": "7d6e0f2a-0cbe-43d7-b2bb-3651bb6234a6",
  "form_id": "A",
  "rng_seed": "71c9b6bf9118c21a18b1c0bd56444385",
  "status": "abandoned",
  "participant": {
    "participant_code": "P018",
    "recruitment_channel": null,
    "consent": {
      "given": true,
      "consent_version": "v1",
      "at_utc": "2026-06-30T13:00:00Z"
    }
  },
  "environment": {
    "device": "unknown"
  },
  "timing": {
    "started_at_utc": "2026-06-30T13:00:00Z"
  },
  "phase_timings": [],
  "trials": []
}
