{
  "schema_version": "1.0.0",
  "study_id": "HS-01",
  "config_version": "1.0.0",
  "config_sha256": "dcffdeca45b972f5c63a4f2c5d1e66e12823f2686ad7d190229260402d22e49b",
  "session_id": "a40ba971-ba99-4690-b3a4-153cab40853c",
  "form_id": "B",
  "rng_seed": "ad0baec9cca0843206cf5fd86683d787",
  "status": "abandoned",
  "participant": {
    "participant_code": "P010",
    "recruitment_channel": null,
    "consent": {
      "given": true,
      "consent_version": "v1",
      "at_utc": "2026-06-30T12:00:00Z"
    }
  },
  "environment": {
    "device": "unknown"
  },
  "timing": {
    "started_at_utc": "2026-06-30T12:00:00Z"
  },
  "phase_timings": [],
  "trials": []
}
