{
  "schema_version": "1.0.0",
  "study_id": "HS-01",
  "config_version": "1.0.0",
  "config_sha256": "dcffdeca45b972f5c63a4f2c5d1e66e12823f2686ad7d190229260402d22e49b",
  "session_id": "73d0fe4d-3fcc-4c72-a4bd-9fa97b47d0f9",
  "form_id": "B",
  "rng_seed": "48cb0237c7d8720185940b30eae00089",
  "status": "abandoned",
  "participant": {
    "participant_code": "P044",
    "recruitment_channel": null,
    "consent": {
      "given": true,
      "consent_version": "v1",
      "at_utc": "2026-07-01T16:00:00Z"
    }
  },
  "environment": {
    "device": "unknown"
  },
  "timing": {
    "started_at_utc": "2026-07-01T16:00:00Z"
  },
  "phase_timings": [],
  "trials": []
}
