{
  "schema_version": "1.0.0",
  "study_id": "HS-01",
  "config_version": "1.0.0",
  "config_sha256": "dcffdeca45b972f5c63a4f2c5d1e66e12823f2686ad7d190229260402d22e49b",
  "session_id": "b31595c3-6b65-4103-8575-2a4c1ec95680",
  "form_id": "A",
  "rng_seed": "ba7c3d349dd7ffab939f25e40bd49292",
  "status": "abandoned",
  "participant": {
    "participant_code": "P036",
    "recruitment_channel": null,
    "consent": {
      "given": true,
      "consent_version": "v1",
      "at_utc": "2026-06-30T18:00:00Z"
    }
  },
  "environment": {
    "device": "unknown"
  },
  "timing": {
    "started_at_utc": "2026-06-30T18:00:00Z"
  },
  "phase_timings": [],
  "trials": []
}
