{
  "schema_version": "1.0.0",
  "study_id": "HS-01",
  "config_version": "1.0.0",
  "config_sha256": "dcffdeca45b972f5c63a4f2c5d1e66e12823f2686ad7d190229260402d22e49b",
  "session_id": "cc0d11e6-fe76-45d5-9da5-7a1b20749b00",
  "form_id": "C",
  "rng_seed": "ac5eb5af7b5b8ad073f509b38717ce5c",
  "status": "abandoned",
  "participant": {
    "participant_code": "P006",
    "recruitment_channel": null,
    "consent": {
      "given": true,
      "consent_version": "v1",
      "at_utc": "2026-06-25T19:00:00Z"
    }
  },
  "environment": {
    "device": "unknown"
  },
  "timing": {
    "started_at_utc": "2026-06-25T19:00:00Z"
  },
  "phase_timings": [],
  "trials": []
}
