{
  "schema_version": "1.0.0",
  "study_id": "HS-01",
  "config_version": "1.0.0",
  "config_sha256": "dcffdeca45b972f5c63a4f2c5d1e66e12823f2686ad7d190229260402d22e49b",
  "session_id": "54a6c36d-2310-4d0b-9255-c505c507bfae",
  "form_id": "A",
  "rng_seed": "0a5066e2a5e812f0670b2656b87fef22",
  "status": "abandoned",
  "participant": {
    "participant_code": "P015",
    "recruitment_channel": null,
    "consent": {
      "given": true,
      "consent_version": "v1",
      "at_utc": "2026-06-30T13:00:00Z"
    }
  },
  "environment": {
    "device": "unknown"
  },
  "timing": {
    "started_at_utc": "2026-06-30T13:00:00Z"
  },
  "phase_timings": [],
  "trials": []
}
