{
  "schema_version": "1.1.0",
  "study_id": "HS-01",
  "config_version": "1.0.0",
  "config_sha256": "dcffdeca45b972f5c63a4f2c5d1e66e12823f2686ad7d190229260402d22e49b",
  "session_id": "8819f3de-5179-459e-8b16-a1c2ced4e1b8",
  "form_id": "B",
  "rng_seed": "fa4758acb1d1c4e750eeb36eed4c6a22",
  "status": "abandoned",
  "participant": {
    "participant_code": "P013",
    "recruitment_channel": null,
    "consent": {
      "given": true,
      "consent_version": "v1",
      "at_utc": "2026-06-30T13:00:00Z"
    }
  },
  "environment": {
    "device": "desktop",
    "is_touch": false,
    "render_check": {
      "passed": true,
      "method": "canvas_homoglyph_v1"
    }
  },
  "timing": {
    "started_at_utc": "2026-06-30T13:00:00Z"
  },
  "phase_timings": [
    {
      "phase_id": "image",
      "entered_ms": 9818,
      "exited_ms": 85048
    }
  ],
  "trials": [
    {
      "trial_index": 0,
      "phase_id": "image",
      "position_in_phase": 0,
      "item_id": "img-HS-GEN-02-llava-s747-g23-p370",
      "source_id": "src-HS-GEN-02-llava-s747-g23-p370",
      "item_kind": "image",
      "is_attention_check": false,
      "presented": {
        "scale_id": "image-clarity-v1",
        "option_display_order": null,
        "option_labels": null,
        "rendered_image": {
          "css_w": 256,
          "css_h": 256,
          "natural_w": 256,
          "natural_h": 256
        }
      },
      "response": {
        "scale_value": 4,
        "other_class_text": null,
        "n_changes": 0
      },
      "timing": {
        "image_loaded_ms": 10040,
        "onset_ms": 10056,
        "first_interaction_ms": 19311,
        "response_selected_ms": 19311,
        "submitted_ms": 19568
      }
    },
    {
      "trial_index": 1,
      "phase_id": "image",
      "position_in_phase": 1,
      "item_id": "img-HS-GEN-03-llava-s2360-g27-p310",
      "source_id": "src-HS-GEN-03-llava-s2360-g27-p310",
      "item_kind": "image",
      "is_attention_check": false,
      "presented": {
        "scale_id": "image-clarity-v1",
        "option_display_order": null,
        "option_labels": null,
        "rendered_image": {
          "css_w": 256,
          "css_h": 256,
          "natural_w": 256,
          "natural_h": 256
        }
      },
      "response": {
        "scale_value": 4,
        "other_class_text": null,
        "n_changes": 0
      },
      "timing": {
        "image_loaded_ms": 19737,
        "onset_ms": 19749,
        "first_interaction_ms": 29895,
        "response_selected_ms": 29895,
        "submitted_ms": 30153
      }
    },
    {
      "trial_index": 2,
      "phase_id": "image",
      "position_in_phase": 2,
      "item_id": "img-rt-llava-green_iguana-0",
      "source_id": "src-rt-llava-green_iguana-0",
      "item_kind": "image",
      "is_attention_check": false,
      "presented": {
        "scale_id": "image-clarity-v1",
        "option_display_order": null,
        "option_labels": null,
        "rendered_image": {
          "css_w": 500,
          "css_h": 334,
          "natural_w": 500,
          "natural_h": 334
        }
      },
      "response": {
        "scale_value": 4,
        "other_class_text": null,
        "n_changes": 0
      },
      "timing": {
        "image_loaded_ms": 30313,
        "onset_ms": 30327,
        "first_interaction_ms": 39375,
        "response_selected_ms": 39375,
        "submitted_ms": 39632
      }
    },
    {
      "trial_index": 3,
      "phase_id": "image",
      "position_in_phase": 3,
      "item_id": "img-raw-junco",
      "source_id": "src-raw-junco",
      "item_kind": "image",
      "is_attention_check": false,
      "presented": {
        "scale_id": "image-clarity-v1",
        "option_display_order": null,
        "option_labels": null,
        "rendered_image": {
          "css_w": 500,
          "css_h": 500,
          "natural_w": 500,
          "natural_h": 500
        }
      },
      "response": {
        "scale_value": 4,
        "other_class_text": null,
        "n_changes": 0
      },
      "timing": {
        "image_loaded_ms": 39789,
        "onset_ms": 39804,
        "first_interaction_ms": 43900,
        "response_selected_ms": 43900,
        "submitted_ms": 44150
      }
    },
    {
      "trial_index": 4,
      "phase_id": "image",
      "position_in_phase": 4,
      "item_id": "img-rt-llava-boa_constrictor-1",
      "source_id": "src-rt-llava-boa_constrictor-1",
      "item_kind": "image",
      "is_attention_check": false,
      "presented": {
        "scale_id": "image-clarity-v1",
        "option_display_order": null,
        "option_labels": null,
        "rendered_image": {
          "css_w": 489,
          "css_h": 500,
          "natural_w": 489,
          "natural_h": 500
        }
      },
      "response": {
        "scale_value": 4,
        "other_class_text": null,
        "n_changes": 0
      },
      "timing": {
        "image_loaded_ms": 44310,
        "onset_ms": 44324,
        "first_interaction_ms": 54131,
        "response_selected_ms": 54131,
        "submitted_ms": 54382
      }
    },
    {
      "trial_index": 5,
      "phase_id": "image",
      "position_in_phase": 5,
      "item_id": "img-Exp-101q-qwen-s28-g47-p180",
      "source_id": "src-Exp-101q-qwen-s28-g47-p180",
      "item_kind": "image",
      "is_attention_check": false,
      "presented": {
        "scale_id": "image-clarity-v1",
        "option_display_order": null,
        "option_labels": null,
        "rendered_image": {
          "css_w": 256,
          "css_h": 256,
          "natural_w": 256,
          "natural_h": 256
        }
      },
      "response": {
        "scale_value": 4,
        "other_class_text": null,
        "n_changes": 0
      },
      "timing": {
        "image_loaded_ms": 54537,
        "onset_ms": 54551,
        "first_interaction_ms": 62908,
        "response_selected_ms": 62908,
        "submitted_ms": 63164
      }
    },
    {
      "trial_index": 6,
      "phase_id": "image",
      "position_in_phase": 6,
      "item_id": "img-HS-GEN-01-llava-s58-g63-p200",
      "source_id": "src-HS-GEN-01-llava-s58-g63-p200",
      "item_kind": "image",
      "is_attention_check": false,
      "presented": {
        "scale_id": "image-clarity-v1",
        "option_display_order": null,
        "option_labels": null,
        "rendered_image": {
          "css_w": 256,
          "css_h": 256,
          "natural_w": 256,
          "natural_h": 256
        }
      },
      "response": {
        "scale_value": 4,
        "other_class_text": null,
        "n_changes": 0
      },
      "timing": {
        "image_loaded_ms": 63331,
        "onset_ms": 63344,
        "first_interaction_ms": 71646,
        "response_selected_ms": 71646,
        "submitted_ms": 71903
      }
    },
    {
      "trial_index": 7,
      "phase_id": "image",
      "position_in_phase": 7,
      "item_id": "img-HS-GEN-01-llava-s102-g38-p00",
      "source_id": "src-HS-GEN-01-llava-s102-g38-p00",
      "item_kind": "image",
      "is_attention_check": false,
      "presented": {
        "scale_id": "image-clarity-v1",
        "option_display_order": null,
        "option_labels": null,
        "rendered_image": {
          "css_w": 256,
          "css_h": 256,
          "natural_w": 256,
          "natural_h": 256
        }
      },
      "response": {
        "scale_value": 4,
        "other_class_text": null,
        "n_changes": 0
      },
      "timing": {
        "image_loaded_ms": 72072,
        "onset_ms": 72086,
        "first_interaction_ms": 78448,
        "response_selected_ms": 78448,
        "submitted_ms": 78710
      }
    },
    {
      "trial_index": 8,
      "phase_id": "image",
      "position_in_phase": 8,
      "item_id": "img-raw-boa_constrictor",
      "source_id": "src-raw-boa_constrictor",
      "item_kind": "image",
      "is_attention_check": false,
      "presented": {
        "scale_id": "image-clarity-v1",
        "option_display_order": null,
        "option_labels": null,
        "rendered_image": {
          "css_w": 375,
          "css_h": 500,
          "natural_w": 375,
          "natural_h": 500
        }
      },
      "response": {
        "scale_value": 4,
        "other_class_text": null,
        "n_changes": 0
      },
      "timing": {
        "image_loaded_ms": 78879,
        "onset_ms": 78893,
        "first_interaction_ms": 84797,
        "response_selected_ms": 84797,
        "submitted_ms": 85048
      }
    }
  ]
}
