{
  "schema_version": "1.0.0",
  "study_id": "HS-01",
  "config_version": "1.0.0",
  "config_sha256": "dcffdeca45b972f5c63a4f2c5d1e66e12823f2686ad7d190229260402d22e49b",
  "session_id": "0b96d1fe-8fad-435d-b4c9-534719442a47",
  "form_id": "B",
  "rng_seed": "9a9f7bbb746a38fe5fe98a4d54eb6b10",
  "status": "abandoned",
  "participant": {
    "participant_code": "P016",
    "recruitment_channel": null,
    "consent": {
      "given": true,
      "consent_version": "v1",
      "at_utc": "2026-06-30T13:00:00Z"
    }
  },
  "environment": {
    "device": "unknown"
  },
  "timing": {
    "started_at_utc": "2026-06-30T13:00:00Z"
  },
  "phase_timings": [],
  "trials": []
}
